{
  "$schema": "https://json-schema.org/draft/2020-12/schema",
  "$id": "state/prd-updated.json",
  "title": "PRD Updated Message",
  "description": "Notification that an existing PRD has been updated",
  "type": "object",
  "properties": {
    "type": {
      "type": "string",
      "const": "prd-updated"
    },
    "id": {
      "type": "string",
      "format": "uuid"
    },
    "device_id": {
      "type": "string"
    },
    "timestamp": {
      "type": "string",
      "format": "date-time"
    },
    "payload": {
      "type": "object",
      "properties": {
        "prd": {
          "type": "object",
          "description": "The updated PRD"
        }
      },
      "required": ["prd"],
      "additionalProperties": false
    }
  },
  "required": ["type", "id", "device_id", "timestamp", "payload"],
  "additionalProperties": false
}
