{
  "type": "prd-updated",
  "id": "550e8400-e29b-41d4-a716-446655440021",
  "device_id": "device-abc-123",
  "timestamp": "2026-03-22T12:05:00Z",
  "payload": {
    "prd": {
      "id": "b2c3d4e5-f6a7-8901-bcde-f12345678901",
      "project_id": "a1b2c3d4-e5f6-7890-abcd-ef1234567890",
      "title": "Add user auth",
      "status": "completed",
      "progress": "All stories implemented and tested"
    }
  }
}
